{
  "$schema": "https://json-schema.org/draft/2020-12/schema",
  "$id": "vvfp.vv4_full256_serializer_evidence.v1",
  "type": "object",
  "required": ["schema_version","status","publication","bindings","geometry","stock_functions","current_candidate","required_semantics","replacement","atomic_writer","runtime_fault_matrix","evidence","enabled"],
  "additionalProperties": false,
  "properties": {
    "schema_version":{"const":"vvfp.vv4_full256_serializer_evidence.v1"},"status":{"const":"static_reference_stop"},"publication":{"type":"object"},"bindings":{"type":"object"},"geometry":{"type":"object"},"stock_functions":{"type":"object"},"current_candidate":{"type":"object"},"required_semantics":{"type":"object"},"replacement":{"type":"object"},"atomic_writer":{"type":"object"},"runtime_fault_matrix":{"type":"object"},"evidence":{"type":"array","maxItems":0},"enabled":{"const":false}
  }
}
